{"schemaVersion":2,"contract":"setup-attempt-list","requestId":"request-synthetic","asOf":"2026-10-14T08:00:00+00:00","items":[{"attemptId":"attempt-synthetic","setupId":"setup-synthetic","walletId":"wallet-synthetic","instrumentId":"instrument-synthetic","mode":"paper","acceptedPlanRevisionId":"plan-synthetic-1","acceptedPreviewId":"preview-synthetic","decisionAtUtc":"2026-10-14T08:00:00+00:00","knownAtUtc":"2026-10-14T08:00:00+00:00","publicationSequence":4}],"nextCursor":null,"setupRevision":2,"publicationWatermark":4,"snapshotCursor":"synthetic-setup-attempt-snapshot-cursor"}
